<?xml version="1.0" encoding="UTF-8"?>
<forms xmlns:xsi="http://www.w3.org/2001/XMLSchema-instance" xsi:schemaLocation="http://qingpei.me/COMP5323
FORM_POOL.xsd">
	<form>
		<leader>
			<name>Darhon</name>
			<studentID>22341234</studentID>
			<mobile_number/>
			<department>ISE</department>
			<year>2010</year>
			<name_cn/>
			<prog/>
			<prog_code/>
			<mode>Full</mode>
			<address/>
			<home_number/>
			<email/>
		</leader>
		<members>
			<group_member>
				<name>Turdack</name>
				<studentID>12341234</studentID>
				<mobile_number/>
				<department>COMP</department>
				<year>2011</year>
			</group_member>
		</members>
		<details>
			<project_name>Proj of Darhon</project_name>
			<objectives/>
			<activity_item>
				<activity_name>act 1</activity_name>
				<datetime>
					<date>2012-06-15</date>
				</datetime>
				<place>Somewhere</place>
				<type_of_user/>
				<number_of_user>650</number_of_user>
			</activity_item>
			<preparation/>
			<benefits/>
			<eval_mech/>
		</details>
		<budget>
			<income_item>
				<applied>70000</applied>
				<source/>
			</income_item>
			<total_income>
				<applied>70000</applied>
			</total_income>
			<expenditure_item>
				<applied>70000</applied>
				<description/>
			</expenditure_item>
			<total_expenditure>
				<applied>70000</applied>
			</total_expenditure>
			<advance_partial_payment>
				<dismiss/>
			</advance_partial_payment>
		</budget>
		<declaration>
			<studentID/>
			<name/>
			<date>2012-02-20</date>
		</declaration>
	</form>
	<form>
		<leader>
			<name>Threl</name>
			<studentID>32341234</studentID>
			<mobile_number/>
			<department>COMP</department>
			<year>2011</year>
			<name_cn/>
			<prog/>
			<prog_code/>
			<mode>Full</mode>
			<address/>
			<home_number/>
			<email/>
		</leader>
		<members/>
		<details>
			<project_name>Proj of Threl</project_name>
			<objectives/>
			<activity_item>
				<activity_name>act 1</activity_name>
				<datetime>
					<date>2012-06-20</date>
				</datetime>
				<place>Somewhere</place>
				<type_of_user/>
				<number_of_user>50</number_of_user>
			</activity_item>
			<activity_item>
				<activity_name>act 2</activity_name>
				<datetime>
					<date>2012-06-21</date>
				</datetime>
				<place>Somewhere else</place>
				<type_of_user/>
				<number_of_user>1500</number_of_user>
			</activity_item>
			<preparation/>
			<benefits/>
			<eval_mech/>
		</details>
		<budget>
			<income_item>
				<applied>30000</applied>
				<source/>
			</income_item>
			<total_income>
				<applied>30000</applied>
			</total_income>
			<expenditure_item>
				<applied>50000</applied>
				<description/>
			</expenditure_item>
			<total_expenditure>
				<applied>50000</applied>
			</total_expenditure>
			<advance_partial_payment>
				<dismiss/>
			</advance_partial_payment>
		</budget>
		<declaration>
			<studentID/>
			<name/>
			<date>2012-02-20</date>
		</declaration>
	</form>
	<form>
		<leader>
			<name>Turdack</name>
			<studentID>12341234</studentID>
			<mobile_number/>
			<department>COMP</department>
			<year>2011</year>
			<name_cn/>
			<prog/>
			<prog_code/>
			<mode>Part</mode>
			<address/>
			<home_number/>
			<email/>
		</leader>
		<members/>
		<details>
			<project_name>Proj of Turdack</project_name>
			<objectives/>
			<activity_item>
				<activity_name>act 1</activity_name>
				<datetime>
					<date>2012-06-20</date>
				</datetime>
				<place>Somewhere</place>
				<type_of_user/>
				<number_of_user>50</number_of_user>
			</activity_item>
			<preparation/>
			<benefits/>
			<eval_mech/>
		</details>
		<budget>
			<income_item>
				<applied>30000</applied>
				<source/>
			</income_item>
			<total_income>
				<applied>30000</applied>
			</total_income>
			<expenditure_item>
				<applied>30000</applied>
				<description/>
			</expenditure_item>
			<total_expenditure>
				<applied>30000</applied>
			</total_expenditure>
			<advance_partial_payment>
				<dismiss/>
			</advance_partial_payment>
		</budget>
		<declaration>
			<studentID/>
			<name/>
			<date>2012-02-20</date>
		</declaration>
	</form>
</forms>
